<?xml version="1.0" standalone="no"?>
<!DOCTYPE sector_file SYSTEM "../sectorfiles.dtd">
<!--
    Notes:
        See sectorfiles.dtd in this directory for full notes.  All DTD information
        is contained there.
-->
<sector_file xmlns:py="http://codespeak.net/lxml/objectify/pytype">

  <sector name="Global" download="yes" active="yes" operational="no" dynamic_datetime="" dynamic="no" composite='yes'>
    <destinations />
    <name>
      <continent>Global</continent>
      <country></country>
      <area/>
      <subarea/>
      <state/>
      <city/>
    </name>
    <area_info>
      <center_lat>0N</center_lat>
      <center_lon>0E</center_lon>
      <num_lines>1000</num_lines>
      <num_samples>2000</num_samples>
      <pixel_width>20</pixel_width>
      <pixel_height>20</pixel_height>
      <projection>cyl</projection>
    </area_info>
    <plot_info>
      <grid_size>5</grid_size>
      <grid_lon_size>20</grid_lon_size> 
      <min_cover>0.01</min_cover>
      <min_total_cover>0.01</min_total_cover>
      <char_size>12</char_size>
      <map_resolution>intermediate</map_resolution>
    </plot_info>
    <source name="seviri">
        <product name="Geo-Stitched"/>
    </source>
    <source name="abi">
        <product name="Geo-Stitched"/>
    </source>
    <source name="ahi">
        <product name="Geo-Stitched"/>
    </source>
  </sector>
</sector_file>
